pub_date	title	venue	excerpt	citation	url_slug	paper_url	
2012-02-01	Engineering Deutsch-Jozsa Algorithm in Cavity QED via Bragg Regime	COMSATS Institute of Information Technology Undergrad Thesis	The theory of quantum mechanics, developed as a limiting case to classical mechanics, notwithstanding its interpretive difficulties, has with it the elegance for paving way to a variety of applications. One such application is the implementation of a working Quantum Computer. The push one receives for using quantum principles as a measure of information and execution of algorithms is from quantum parallelism. It seems as though nature hides its enormous calculations. One such realisation of the power of Quantum Parallelism can be seen with quantum optics when one considers engineering a Quantum Computer, choosing techniques of cavity QED amongst many other competitors. The Deutsch-Josza algorithm, although of little practical significance, is an encouraging example which greatly reduces the time required for a specific function to be determined completely, when compared with its classical counterpart. The Hadamard gate has been physically realised, and so has the other unitary transformations in the Deutsch-Jozsa algorithm using different times of interactions in the cavity. Also, a generalisation of the Deutsch-Jozsa algorithm has been discussed, which might pave way for a working model of a Quantum Computer	Malik, Abdullah Naeem. Engineering Deutsch-Jozsa Algorithm in Cavity QED via Bragg Regime. Diss. COMSATS INSTITUTE OF INFORMATION TECHNOLOGY, ISLAMABAD, 2012	files/Engineering the Deutsch-Jozsa Algorithm.pdf	http://abdullahnaeemmalik.github.io/files/Engineering the Deutsch-Jozsa Algorithm.pdf	
2016-04-01	Operator Algebras and the Foundations of Quantum Mechanics	Quaid-i-Azam University	The purpose of this thesis is to analyse the Hilbert Space requirement for Quantum Mechanics. In particular, we justify sharp observables but question the requirement of completeness of the inner product space and the underlying field. We view our mathematical framework as a dynamical theory but with a mysterious probabilistic interpretation instead of the otherway round. Whenever we speak of Quantum Mechanics, we mean Non-relativistic Quantum Mechanics. To make things less messy, we assume associativity through-out. No attempt has been made to refer to QFT and statistical quantum mechanics and we use conventional mathematical symbols instead of Dirac's formalism	Malik, Abdullah Naeem. Operator Algebras and Foundations of Quantum Mechanics. Diss. QUAID-E-AZAM UNIVERSITY, ISLAMABAD, 2016	2016-04-01-Operator-Algebras-and-the-Foundations-of-Quantum-Mechanics	http://abdullahnaeemmalik.github.io/files/Operator Algebras and the Foundations of Quantum Mechanics.pdf	
2022-01-25	Technology-embedded Hybrid Learning	Preprint	In this paper, we present the recently piloted project by COMSATS University Islamabad (previously known as COMSATS Institute of Information Technology) which is driven by technology-embedded teaching model. This model is an amalgam of the traditional class room model with the aid of state-of-the-art online learning technologies	Behzad, M.; Adnan, N.; Naeem Malik, A.; Merchant, S.A. Technology-Embedded Hybrid Learning. Preprints 2018, 2018030229, https://doi.org/10.20944/preprints201803.0229.v2	/files/Technology Embedded Hybrid Learning.pdf	https://www.preprints.org/manuscript/201803.0229/v2	
2016-10-25	Orthomodularity and the incompatibility of relativity and quantum mechanics	Quantum Studies: Mathematics and Foundations (Springer)	We show that orthomodularity in general and non-existence of isotropic vectors in particular decisively yield the geometry of quantum mechanics and that a fundamental reason why quantum mechanics and relativity cannot be unified is because of the non-existence of isotropic vectors.	Malik, A.N., Kamran, T. Orthomodularity and the incompatibility of relativity and quantum mechanics. Quantum Stud.: Math. Found. 4, 171–179 (2017). https://doi.org/10.1007/s40509-016-0092-8	/files/orthomodularity-and-incompatibility-of-relativity-and-quantum-mechanics	https://link.springer.com/article/10.1007/s40509-016-0092-8	
2016-02-25	Non-isometric involutive antiautomorphisms	arXiv	We exhibit a non-constructive proof in which anti-automorphisms are not valuation-preserving and hence non-isometric	arXiv:1603.08498 [math.RA]	/files/non-isometric-involutive-anti-automorphisms	https://arxiv.org/pdf/1603.08498.pdf	
2017-11-30	Effects of Gender on the Performance of Microenterprises in Pakistan	The International Journal of Humanities and Social Studies	In Pakistan, there has been a surge in women entrepreneurship, either as a sole proprietorship or joint partnership mostly with male family members. Using non-randomized data, in this paper we compare the impact of owner's gender on the performance of the enterprise in Pakistan. Our results show an intricate association between the gender of the owner and the performance of the enterprise. While there is no significant difference in the performance with respect to profitability of the business, however, female owned enterprises have shown more employment growth as compared to male owned enterprises. Results of OLS regression on the basis of gender show that common factors that affect the performance of the enterprises have assorted effects for male-owned and female-owned enterprises. For female entrepreneurs, education in the most significant factor in their business success.	Xing, Y. H., Farooq, M. U., & Malik, A. N. (2017). Effects of Gender on the Performance of Microenterprises in Pakistan. The International Journal of Humanities & Social Studies, 5(11).	/files/effects-of-gender-on-the-performance-of-microenterprises-in-Pakistan	https://www.internationaljournalcorner.com/index.php/theijhss/article/view/125536	
